<?xml version="1.0"?>
<!DOCTYPE studentdetails SYSTEM "program5_1.dtd">
<?xml-stylesheet type="text/xsl" href="program5_3.xsl"?>
<studentdetails>
    <students>
        <USN>4JC14CS134</USN>
        <Name>Rakshith</Name>
        <College>SJCE, Mysuru</College>
        <Branch>Computer Science</Branch>
        <Joining>2014</Joining>
        <Email>rrvbnm@gmail.com</Email>
    </students>
    <students>
        <USN>4NI14CS080</USN>
        <Name>Ravi Teja</Name>
        <College>NIE, Mysuru</College>
        <Branch>Computer Science</Branch>
        <Joining>2014</Joining>
        <Email>ravi.teja@gmail.com</Email>
    </students>
    <students>
        <USN>4JC14IS002</USN>
        <Name>Anup Kalyan</Name>
        <College>SJCE, Mysuru</College>
        <Branch>Information Science</Branch>
        <Joining>2014</Joining>
        <Email>kalyan@gmail.com</Email>
    </students>
</studentdetails>
